{
  "$schema": "https://json-schema.org/draft/2020-12/schema",
  "$id": "https://gismap.online/schemas/map-v1.schema.json",
  "title": "GIS Map Online map spec (map-v1)",
  "description": "A whole map as one JSON object: layers with styles and filters, basemap, look and camera. Open it at https://gismap.online/#map=json:<URI-encoded JSON> (written by hand, up to 8 KB), as the compressed #map= form from mapSpec.createLink, or host the file and open https://gismap.online/?spec=<https URL>. Invalid parts are skipped and reported; the rest of the map still opens.",
  "type": "object",
  "required": ["layers"],
  "properties": {
    "$schema": { "type": "string", "description": "Optional: https://gismap.online/schemas/map-v1.schema.json." },
    "version": { "const": 1, "default": 1, "description": "The spec version. Always 1." },
    "title": { "type": "string", "maxLength": 160, "description": "The map's name, shown as the project title." },
    "description": { "type": "string", "maxLength": 2000, "description": "What the map shows, for people reading the spec." },
    "basemap": {
      "enum": ["topo-3d", "navigation-3d", "navigation-dark-3d", "osm-3d", "gray-3d", "dark-gray-3d", "streets-3d", "streets-dark-3d", "topo-vector", "streets-vector", "navigation", "gray-vector", "dark-gray-vector", "osm", "satellite", "hybrid", "usgs-imagery", "usgs-imagery-topo", "open-liberty", "open-bright", "open-positron", "open-dark", "open-fiord", "skin"],
      "description": "The background map. gray-vector and dark-gray-vector keep attention on the data; the open-* basemaps are OpenFreeMap styles (MapLibre engine; ArcGIS draws the nearest match); skin draws it in the colours of the interface skin (with the MapLibre engine; the ArcGIS engine uses the light or dark gray canvas)."
    },
    "skin": {
      "enum": ["gismap", "clean-light", "dark-analytical", "tidal-95", "portolan", "velvet-orbit", "violet-circuit", "highway", "steeler", "slice", "wavelength", "connect"],
      "description": "The interface look. It never changes a layer's style; with the skin basemap the map is drawn in its colours, and with the MapLibre engine layers that have no style take its accent colour."
    },
    "camera": {
      "description": "Where the map looks. Default { \"fit\": \"layers\" }: fit the loaded data (its dense core when it spreads over half the world).",
      "oneOf": [
        { "type": "object", "required": ["fit"], "properties": { "fit": { "enum": ["layers", "none"], "description": "\"layers\" fits the data; \"none\" keeps the starting view." } }, "additionalProperties": false },
        {
          "type": "object",
          "required": ["center"],
          "properties": {
            "center": { "type": "array", "prefixItems": [{ "type": "number", "minimum": -180, "maximum": 180 }, { "type": "number", "minimum": -90, "maximum": 90 }], "minItems": 2, "maxItems": 2, "description": "[longitude, latitude] in degrees." },
            "zoom": { "type": "number", "minimum": 0, "maximum": 24, "description": "Zoom level (about 4 = a country, 10 = a city)." },
            "scale": { "type": "number", "minimum": 1, "description": "Map scale denominator, instead of zoom." },
            "heading": { "type": "number", "minimum": -360, "maximum": 360, "default": 0, "description": "Compass direction the camera faces, in degrees." },
            "tilt": { "type": "number", "minimum": 0, "maximum": 90, "default": 0, "description": "0 looks straight down; higher values look toward the horizon." }
          },
          "additionalProperties": false
        }
      ]
    },
    "layers": {
      "type": "array",
      "minItems": 1,
      "maxItems": 10,
      "description": "The data, drawn in order (the last is on top). At most 10.",
      "items": { "$ref": "#/$defs/layer" }
    },
    "legend": { "type": "boolean", "default": false, "description": "Open the legend." },
    "briefing": {
      "description": "Optional slides that present the map, as a briefing-v1 document (https://gismap.online/schemas/briefing-v1.schema.json). Its layerId may be one of the layer URLs.",
      "oneOf": [{ "$ref": "https://gismap.online/schemas/briefing-v1.schema.json" }, { "type": "null" }]
    }
  },
  "additionalProperties": false,
  "$defs": {
    "layer": {
      "type": "object",
      "required": ["url"],
      "properties": {
        "url": { "type": "string", "format": "uri", "pattern": "^https://", "description": "HTTPS URL of an ArcGIS REST layer or service (FeatureServer/0, MapServer, ImageServer), a GeoJSON file, or a WMS/WFS/KML service. Public only: no tokens or keys. The service must allow browser (CORS) access. Append ?f=pjson to an ArcGIS URL to see its fields." },
        "type": { "enum": ["arcgis-auto", "feature", "map-image", "imagery", "geojson", "geoparquet", "wms", "wfs", "kml", "pointcloud", "model"], "default": "arcgis-auto", "description": "The layer type; arcgis-auto detects it from the service, and from .las/.laz/.xyz (pointcloud) or .glb/.gltf/.obj/.ply (model) file extensions. pointcloud and model draw with three.js on the MapLibre engine." },
        "title": { "type": "string", "maxLength": 160, "description": "The name shown in the Layers panel and legend." },
        "where": { "type": "string", "maxLength": 2000, "description": "A read-only SQL filter on the layer's fields, such as \"CORN_SALES_IN_DOLLARS >= 0\" or \"STATE = 'Iowa'\". No statements, comments or semicolons." },
        "renderer": { "$ref": "https://gismap.online/schemas/renderer-v1.schema.json", "description": "The style. Field names must match the service exactly; a misspelled field keeps the service's own style and is reported." },
        "scene3d": {
          "type": "object",
          "description": "Options for pointcloud and model layers (MapLibre engine, drawn with three.js). Elevations are real heights in metres after unit conversion, not virtual Z.",
          "properties": {
            "crs": { "type": "string", "maxLength": 6000, "description": "The data's coordinate system: EPSG:<code>, a proj4 string or WKT. LAS/LAZ files usually carry it; XYZ files and CAD models in projected coordinates need it." },
            "colorBy": { "enum": ["auto", "rgb", "classification", "elevation", "intensity"], "description": "Point colours; auto uses RGB, then ASPRS classification, then elevation." },
            "pointSize": { "type": "number", "minimum": 1, "maximum": 12, "description": "Point size in screen pixels." },
            "maxPoints": { "type": "integer", "minimum": 1000, "maximum": 5000000, "description": "Larger clouds are thinned evenly to this many points." },
            "classes": { "type": "array", "maxItems": 64, "items": { "type": "integer", "minimum": 0, "maximum": 255 }, "description": "Show only these ASPRS classes, such as [5, 14] for high vegetation and conductor wires." },
            "animate": { "type": "object", "properties": { "type": { "const": "reveal" }, "durationMs": { "type": "number", "minimum": 1000, "maximum": 120000 }, "loop": { "type": "boolean" } }, "description": "Reveal the points from lowest to highest on the shared animation clock." },
            "anchor": { "type": "array", "minItems": 2, "maxItems": 3, "items": { "type": "number" }, "description": "Model placement: [longitude, latitude, altitude in metres]." },
            "heading": { "type": "number", "minimum": -360, "maximum": 360, "description": "Model rotation clockwise from north, in degrees." },
            "scale": { "type": "number", "minimum": 0.000001, "maximum": 1000000, "description": "Model units to metres." },
            "upAxis": { "enum": ["y", "z"], "description": "glTF is Y-up; many CAD exports are Z-up." },
            "color": { "type": "string", "pattern": "^#[0-9a-fA-F]{6}$", "description": "A colour for untextured models." },
            "heightReference": { "enum": ["ground", "absolute"], "description": "ground (default): heights above the data's own ground level, placed on the terrain; absolute: surveyed elevations as they are." },
            "zOffset": { "type": "number", "minimum": -10000, "maximum": 10000, "description": "Metres added to every height." },
            "verticalExaggeration": { "type": "number", "minimum": 0.1, "maximum": 20 }
          },
          "additionalProperties": false
        },
        "animatedEffect": {
          "type": "object",
          "required": ["type"],
          "description": "Decorative animated effect drawn on the layer's features (MapLibre engine; other engines show the layer without it). It is visual annotation, never data. auto picks one from the layer's title, geometry and fields; pulse sizes rings by a magnitude field and wind follows direction/speed fields when present.",
          "properties": {
            "type": { "enum": ["auto", "glow", "fire", "pulse", "wind", "water", "flow", "traffic", "trains", "extrude", "reveal"] },
            "intensity": { "type": "number", "minimum": 0.25, "maximum": 2, "default": 1 },
            "color": { "type": ["string", "null"], "pattern": "^#[0-9a-fA-F]{6}$" },
            "field": { "type": "string", "maxLength": 160, "description": "The numeric field a Rise (extrude) or Reveal reads; chosen from the layer when absent." }
          },
          "additionalProperties": false
        },
        "spatialChart": {
          "type": "object",
          "required": ["type", "mode", "height"],
          "description": "3D spatial chart settings (MapLibre and ArcGIS engines). Z values are display offsets, never physical altitude. source-footprints/none is the fast display strategy and does not calculate exact polygon overlaps.",
          "properties": {
            "type": { "const": "spatial-3d-chart" },
            "mode": { "enum": ["attribute-extrusion", "temporal-strata", "stacked-footprints", "exploded-timeline"] },
            "groupBy": { "type": "string", "pattern": "^[A-Za-z_][A-Za-z0-9_.]*$" },
            "groups": { "type": "array", "maxItems": 40, "items": { "type": ["string", "number"] } },
            "height": { "type": "object" },
            "color": { "type": "object" },
            "geometry": { "type": "object" },
            "interaction": { "type": "object" }
          },
          "additionalProperties": false
        },
        "opacity": { "type": "number", "minimum": 0, "maximum": 1, "default": 1, "description": "0 is transparent, 1 is opaque." },
        "visible": { "type": "boolean", "default": true, "description": "Whether the layer starts switched on." },
        "ignoreServiceScaleRange": { "type": "boolean", "default": false, "description": "Draw at every zoom level, even where the publisher hides the layer (its minScale/maxScale)." },
        "refreshInterval": { "type": "number", "minimum": 0, "maximum": 1440, "description": "Reload the layer every this many minutes (for live feeds)." },
        "popup": { "type": "object", "properties": { "fields": { "type": "array", "items": { "type": "string" }, "maxItems": 50, "description": "Fields to feature when a feature is inspected." } }, "additionalProperties": false, "description": "Fields of interest for inspecting features." }
      },
      "additionalProperties": false
    }
  }
}
